{
  "allowed_transformations": [
    "Benchmark metadata registration",
    "Future hard benchmark definition"
  ],
  "claim_boundary": {
    "allowed_claims": [
      "sigma_xxx final checkpoint is registered as a protected future benchmark."
    ],
    "forbidden_claims": [
      "Full sigma_abc equals sigma_xxx final formula before the projection benchmark is run."
    ]
  },
  "expected_outputs": [
    "sigma_abc/benchmarks/sigma_xxx_projection_benchmark.md",
    "sigma_abc/benchmarks/benchmark_manifest.json",
    "sigma_abc/benchmarks/sigma_xxx_reference_summary.json"
  ],
  "forbidden_transformations": [
    "Run final kernel-level projection benchmark prematurely",
    "Claim full tensorial correctness"
  ],
  "goal": "Register sigma_xxx final checkpoint as the future projection benchmark.",
  "input_snapshots": [
    "input_snapshots/raw_input_manifest.json",
    "input_snapshots/benchmark_sigma_xxx_projection.json",
    "input_snapshots/final_checkpoint_manifest.json",
    "input_snapshots/stage001b_validation_summary.json"
  ],
  "next_stage_trigger": "Proceed to Stage 004 only if OverallGate is PASS.",
  "protected_regressions": [
    "Stage001DCCaveatPreserved"
  ],
  "stage_name": "003_xxx_projection_benchmark_hardening",
  "validation_identity": {
    "expression": "SigmaXXXBenchmarkRegistered && ProjectionRuleDefined && FinalKernelBenchmarkDeferred && RawLevelProjectionAvailable",
    "type": "ProjectionRegression"
  }
}
